Sr. No,Date,Session Title,Description,Linkedin post
1,8th Nov 2025,Alumni Success Story - Dhruvkumar Patel,"🎓 Alumni Connect Session at LDRP-ITR, KSV! Mr. Dhruvkumar Patel shared valuable insights on research-driven career growth and technical excellence.",https://www.linkedin.com/posts/mmpsrpc_ksv-ldrpitr-mmpsrpc-activity-7393559476517273600-F8s-
2,12th Dec 2025,Students Research Lab Presents: Debate on Plots and Maps,"The MMPSRPC Students Research Lab at KSV nurtures a progressive learning culture where students go beyond routine academics through weekly discussions and spontaneous exercises. This environment enhances analytical thinking, communication, and collaboration, helping students develop a strong research mindset and a more structured academic approach. ",https://www.linkedin.com/posts/mmpsrpc_mmpsrpc-ksv-studentsresearchlab-activity-7405172370459668481-6zQI
3,27th Dec 2025,"Alumni Success Story - Manan Darji (Google), Dhwani Jakhaniya (AMD)","Alumni of the CE Department, LDRP ITR, KSV conducted an insightful interaction session highlighting focused effort, mentorship, and adaptability for professional growth.",https://www.linkedin.com/posts/mmpsrpc_mmpsrpc-ksv-svkm-mmpsrc-activity-7413813644284682240-u9XF
4,3rd Jan 2026,"Alumni Success Story - Shubham Kumar Chandravanshi (Deloitte), Dhruvkumar Patel (Myntra), Jay Patel (QloudX)","The Alumni Connect Session at the Student Research Lab, M. M. Patel Students Research Project Cell, KSV, brought together students and alumni for an insightful interaction focused on industry exposure, career journeys, and key professional learnings.",https://www.linkedin.com/posts/mmpsrpc_ksv-svkm-mmpsrpc-activity-7417800043421843456-rV2a
5,12th Feb 2026,Written and Verbal Articulation of Algorithmic Concepts,"At the Students Research Lab under the M. M. Patel Students Research Project Cell, KSV (MMPSRPC), Kadi Sarva Vishwavidyalaya, Gandhinagar, an academic session focused on efficient analysis of recursive problems using structured and optimized approaches.",https://www.linkedin.com/posts/mmpsrpc_mmpsrpc-ksv-svkm-activity-7412364021376413696-DFUn
6,25th Feb 2026,Algorithm Optimization Through Recurrence Analysis,"At the Students Research Lab under the M. M. Patel Students Research Project Cell, KSV (MMPSRPC), Kadi Sarva Vishwavidyalaya, Gandhinagar, students participated in an interactive session focused on algorithm optimization.",https://www.linkedin.com/posts/mmpsrpc_mmpsrpc-ksv-svkm-activity-7411274469664759809-rDsK